{
  "coverage": [
    {
      "classification": "unreviewed",
      "rationale": "Lossless literal candidate; semantic classification is still required.",
      "requirementIds": [
        "CAND-B0415"
      ],
      "sourceBlock": "B0415"
    },
    {
      "classification": "unreviewed",
      "rationale": "Lossless literal candidate; semantic classification is still required.",
      "requirementIds": [
        "CAND-B0416"
      ],
      "sourceBlock": "B0416"
    },
    {
      "classification": "unreviewed",
      "rationale": "Lossless literal candidate; semantic classification is still required.",
      "requirementIds": [
        "CAND-B0417"
      ],
      "sourceBlock": "B0417"
    }
  ],
  "decisions": [],
  "packetId": "RWP-0065",
  "requirements": [
    {
      "id": "CAND-B0415",
      "sourceBlocks": [
        "B0415"
      ],
      "statement": "类似现代产品里的 command palette。",
      "title": "9.1 命令中心",
      "type": "source-literal"
    },
    {
      "id": "CAND-B0416",
      "sourceBlocks": [
        "B0416"
      ],
      "statement": "用户按快捷键后可以：",
      "title": "9.1 命令中心",
      "type": "source-literal"
    },
    {
      "id": "CAND-B0417",
      "sourceBlocks": [
        "B0417"
      ],
      "statement": "- 搜索菜单。\n- 搜索应用。\n- 搜索数据。\n- 快速新增记录。\n- 快速打开待办。\n- 快速进入配置页。",
      "title": "9.1 命令中心",
      "type": "source-literal"
    }
  ],
  "schemaVersion": 1,
  "source": {
    "planPath": "../analysis-plan.json",
    "planSha256": "ece89d76cc8979bb8ff3c4b80326d77880a565bde040849307d9bfcfe2ebf059"
  }
}
