{
  "coverage": [
    {
      "classification": "unreviewed",
      "rationale": "Lossless literal candidate; semantic classification is still required.",
      "requirementIds": [
        "CAND-B0072"
      ],
      "sourceBlock": "B0072"
    }
  ],
  "decisions": [],
  "packetId": "RWP-0011",
  "requirements": [
    {
      "id": "CAND-B0072",
      "sourceBlocks": [
        "B0072"
      ],
      "statement": "- 模块组只组织运行态模块导航，不是业务数据父级。\n- 应用只提供受控访问，不组织模块。\n- 系统Flow可以绑定模块及其动作或事件；平台Flow可以独立存在。\n- 模块动作负责具体业务操作；公共后台任务、文件和消息能力只承载动作执行，不形成重复业务入口。\n- 普通任务、项目任务和工作日志属于工作管理；Flow任务属于Flow运行数据，二者可以统一展示在待办中，但不能混成一张任务表。\n- 平台待办、消息、任务和Flow与系统内同名能力共享产品模型，但必须按上下文、数据范围、权限和日志隔离。",
      "title": "4.6 能力关系与边界",
      "type": "source-literal"
    }
  ],
  "schemaVersion": 1,
  "source": {
    "planPath": "../analysis-plan.json",
    "planSha256": "ece89d76cc8979bb8ff3c4b80326d77880a565bde040849307d9bfcfe2ebf059"
  }
}
