{
  "coverage": [
    {
      "classification": "unreviewed",
      "rationale": "Lossless literal candidate; semantic classification is still required.",
      "requirementIds": [
        "CAND-B0352"
      ],
      "sourceBlock": "B0352"
    },
    {
      "classification": "unreviewed",
      "rationale": "Lossless literal candidate; semantic classification is still required.",
      "requirementIds": [
        "CAND-B0353"
      ],
      "sourceBlock": "B0353"
    },
    {
      "classification": "unreviewed",
      "rationale": "Lossless literal candidate; semantic classification is still required.",
      "requirementIds": [
        "CAND-B0354"
      ],
      "sourceBlock": "B0354"
    },
    {
      "classification": "unreviewed",
      "rationale": "Lossless literal candidate; semantic classification is still required.",
      "requirementIds": [
        "CAND-B0355"
      ],
      "sourceBlock": "B0355"
    }
  ],
  "decisions": [],
  "packetId": "RWP-0052",
  "requirements": [
    {
      "id": "CAND-B0352",
      "sourceBlocks": [
        "B0352"
      ],
      "statement": "推荐：",
      "title": "7.2 后端技术",
      "type": "source-literal"
    },
    {
      "id": "CAND-B0353",
      "sourceBlocks": [
        "B0353"
      ],
      "statement": "- Java 21。\n- Spring Boot。\n- undertown为容器不用tomcat\n- 自研认证和权限拦截，不使用 Spring Security。\n- MyBatis-Plus。\n- MySQL。\n- Redis。\n- Flyway。\n- MinIO 或 S3 兼容对象存储。\n- 后台作业和轻量事件使用 Redis 实现，不使用 Quartz，不使用消息队列。\n- 接口文档。",
      "title": "7.2 后端技术",
      "type": "source-literal"
    },
    {
      "id": "CAND-B0354",
      "sourceBlocks": [
        "B0354"
      ],
      "statement": "数据库规则：",
      "title": "7.2 后端技术",
      "type": "source-literal"
    },
    {
      "id": "CAND-B0355",
      "sourceBlocks": [
        "B0355"
      ],
      "statement": "- 当前数据库使用 MySQL。\n- SQL 尽量使用标准 SQL，减少数据库私有语法，保证数据库切换成本可控。\n- MySQL 特有能力可以用，但必须控制范围，比如分页、JSON、索引等。\n- 特殊 SQL 统一写在 mapper xml 中，便于替换和维护。\n- 业务接口不要依赖数据库方言太深。",
      "title": "7.2 后端技术",
      "type": "source-literal"
    }
  ],
  "schemaVersion": 1,
  "source": {
    "planPath": "../analysis-plan.json",
    "planSha256": "ece89d76cc8979bb8ff3c4b80326d77880a565bde040849307d9bfcfe2ebf059"
  }
}
