{
  "coverage": [
    {
      "classification": "unreviewed",
      "rationale": "Lossless literal candidate; semantic classification is still required.",
      "requirementIds": [
        "CAND-B0340"
      ],
      "sourceBlock": "B0340"
    },
    {
      "classification": "unreviewed",
      "rationale": "Lossless literal candidate; semantic classification is still required.",
      "requirementIds": [
        "CAND-B0341"
      ],
      "sourceBlock": "B0341"
    },
    {
      "classification": "unreviewed",
      "rationale": "Lossless literal candidate; semantic classification is still required.",
      "requirementIds": [
        "CAND-B0342"
      ],
      "sourceBlock": "B0342"
    },
    {
      "classification": "unreviewed",
      "rationale": "Lossless literal candidate; semantic classification is still required.",
      "requirementIds": [
        "CAND-B0343"
      ],
      "sourceBlock": "B0343"
    },
    {
      "classification": "unreviewed",
      "rationale": "Lossless literal candidate; semantic classification is still required.",
      "requirementIds": [
        "CAND-B0344"
      ],
      "sourceBlock": "B0344"
    }
  ],
  "decisions": [],
  "packetId": "RWP-0050",
  "requirements": [
    {
      "id": "CAND-B0340",
      "sourceBlocks": [
        "B0340"
      ],
      "statement": "移动端重点做使用，不重点做配置。",
      "title": "6.11 移动端",
      "type": "source-literal"
    },
    {
      "id": "CAND-B0341",
      "sourceBlocks": [
        "B0341"
      ],
      "statement": "必须支持：",
      "title": "6.11 移动端",
      "type": "source-literal"
    },
    {
      "id": "CAND-B0342",
      "sourceBlocks": [
        "B0342"
      ],
      "statement": "- 登录。\n- 我的系统。\n- 模块组和模块菜单。\n- 数据列表。\n- 数据表单。\n- 数据详情。\n- 待办审批。\n- 抄送查看。\n- 附件预览。",
      "title": "6.11 移动端",
      "type": "source-literal"
    },
    {
      "id": "CAND-B0343",
      "sourceBlocks": [
        "B0343"
      ],
      "statement": "移动端不做重配置能力：",
      "title": "6.11 移动端",
      "type": "source-literal"
    },
    {
      "id": "CAND-B0344",
      "sourceBlocks": [
        "B0344"
      ],
      "statement": "- 字段设计。\n- 页面设计。\n- 流程设计。\n- 复杂权限配置。",
      "title": "6.11 移动端",
      "type": "source-literal"
    }
  ],
  "schemaVersion": 1,
  "source": {
    "planPath": "../analysis-plan.json",
    "planSha256": "ece89d76cc8979bb8ff3c4b80326d77880a565bde040849307d9bfcfe2ebf059"
  }
}
