{
  "coverage": [
    {
      "classification": "unreviewed",
      "rationale": "Lossless literal candidate; semantic classification is still required.",
      "requirementIds": [
        "CAND-B0474"
      ],
      "sourceBlock": "B0474"
    },
    {
      "classification": "unreviewed",
      "rationale": "Lossless literal candidate; semantic classification is still required.",
      "requirementIds": [
        "CAND-B0475"
      ],
      "sourceBlock": "B0475"
    },
    {
      "classification": "unreviewed",
      "rationale": "Lossless literal candidate; semantic classification is still required.",
      "requirementIds": [
        "CAND-B0476"
      ],
      "sourceBlock": "B0476"
    },
    {
      "classification": "unreviewed",
      "rationale": "Lossless literal candidate; semantic classification is still required.",
      "requirementIds": [
        "CAND-B0477"
      ],
      "sourceBlock": "B0477"
    }
  ],
  "decisions": [],
  "packetId": "RWP-0079",
  "requirements": [
    {
      "id": "CAND-B0474",
      "sourceBlocks": [
        "B0474"
      ],
      "statement": "除了字段必填，还应该支持简单业务规则：",
      "title": "14.4 业务规则配置",
      "type": "source-literal"
    },
    {
      "id": "CAND-B0475",
      "sourceBlocks": [
        "B0475"
      ],
      "statement": "- 某字段满足条件时显示另一个字段。\n- 某字段满足条件时必填。\n- 某状态下不允许编辑。\n- 某金额超过指定值时必须走审批。\n- 某类数据只能指定角色删除。",
      "title": "14.4 业务规则配置",
      "type": "source-literal"
    },
    {
      "id": "CAND-B0476",
      "sourceBlocks": [
        "B0476"
      ],
      "statement": "实现规则：",
      "title": "14.4 业务规则配置",
      "type": "source-literal"
    },
    {
      "id": "CAND-B0477",
      "sourceBlocks": [
        "B0477"
      ],
      "statement": "- 使用结构化条件配置。\n- 不引入复杂脚本。\n- 条件规则要能预览和测试。",
      "title": "14.4 业务规则配置",
      "type": "source-literal"
    }
  ],
  "schemaVersion": 1,
  "source": {
    "planPath": "../analysis-plan.json",
    "planSha256": "ece89d76cc8979bb8ff3c4b80326d77880a565bde040849307d9bfcfe2ebf059"
  }
}
