{
  "coverage": [
    {
      "classification": "unreviewed",
      "rationale": "Lossless literal candidate; semantic classification is still required.",
      "requirementIds": [
        "CAND-B0297"
      ],
      "sourceBlock": "B0297"
    },
    {
      "classification": "unreviewed",
      "rationale": "Lossless literal candidate; semantic classification is still required.",
      "requirementIds": [
        "CAND-B0298"
      ],
      "sourceBlock": "B0298"
    },
    {
      "classification": "unreviewed",
      "rationale": "Lossless literal candidate; semantic classification is still required.",
      "requirementIds": [
        "CAND-B0299"
      ],
      "sourceBlock": "B0299"
    },
    {
      "classification": "unreviewed",
      "rationale": "Lossless literal candidate; semantic classification is still required.",
      "requirementIds": [
        "CAND-B0300"
      ],
      "sourceBlock": "B0300"
    },
    {
      "classification": "unreviewed",
      "rationale": "Lossless literal candidate; semantic classification is still required.",
      "requirementIds": [
        "CAND-B0301"
      ],
      "sourceBlock": "B0301"
    }
  ],
  "decisions": [],
  "packetId": "RWP-0042",
  "requirements": [
    {
      "id": "CAND-B0297",
      "sourceBlocks": [
        "B0297"
      ],
      "statement": "平台主页面仪表盘：",
      "title": "6.3 首页",
      "type": "source-literal"
    },
    {
      "id": "CAND-B0298",
      "sourceBlocks": [
        "B0298"
      ],
      "statement": "- 我的授权系统。\n- 我的待办和今日需处理。\n- 我的消息和未读数量。\n- 最近访问、平台任务和权限范围内的统计。",
      "title": "6.3 首页",
      "type": "source-literal"
    },
    {
      "id": "CAND-B0299",
      "sourceBlocks": [
        "B0299"
      ],
      "statement": "系统仪表盘：",
      "title": "6.3 首页",
      "type": "source-literal"
    },
    {
      "id": "CAND-B0300",
      "sourceBlocks": [
        "B0300"
      ],
      "statement": "- 当前系统和租户信息。\n- 有权限的模块快捷入口。\n- 待办、消息、任务和业务统计。\n- 最近操作和关注的业务数据。",
      "title": "6.3 首页",
      "type": "source-literal"
    },
    {
      "id": "CAND-B0301",
      "sourceBlocks": [
        "B0301"
      ],
      "statement": "应用不提供独立业务首页；应用详情用于查看访问配置、授权范围、状态、版本和调用日志。",
      "title": "6.3 首页",
      "type": "source-literal"
    }
  ],
  "schemaVersion": 1,
  "source": {
    "planPath": "../analysis-plan.json",
    "planSha256": "ece89d76cc8979bb8ff3c4b80326d77880a565bde040849307d9bfcfe2ebf059"
  }
}
