{
  "coverage": [
    {
      "classification": "unreviewed",
      "rationale": "Lossless literal candidate; semantic classification is still required.",
      "requirementIds": [
        "CAND-B0035"
      ],
      "sourceBlock": "B0035"
    }
  ],
  "decisions": [],
  "packetId": "RWP-0006",
  "requirements": [
    {
      "id": "CAND-B0035",
      "sourceBlocks": [
        "B0035"
      ],
      "statement": "- 用户首先以统一平台账号登录。\n- 平台账号可以创建系统，也可以被授权进入其他系统。\n- 用户从平台主页面进入系统时必须生成系统上下文；多租户系统还必须生成租户上下文。\n- 平台账号、系统成员和租户成员是显式映射关系，平台身份不能直接替代系统内身份。\n- 直接从系统专属域名、系统编码或专属路径登录的普通系统用户，认证成功后直接进入其有权限的系统和租户上下文。\n- 用户不能切换角色视角；最终权限由当前上下文内全部有效角色合并计算。",
      "title": "4.1 统一账号与上下文",
      "type": "source-literal"
    }
  ],
  "schemaVersion": 1,
  "source": {
    "planPath": "../analysis-plan.json",
    "planSha256": "ece89d76cc8979bb8ff3c4b80326d77880a565bde040849307d9bfcfe2ebf059"
  }
}
