{
  "coverage": [
    {
      "classification": "unreviewed",
      "rationale": "Lossless literal candidate; semantic classification is still required.",
      "requirementIds": [
        "CAND-B0632"
      ],
      "sourceBlock": "B0632"
    },
    {
      "classification": "unreviewed",
      "rationale": "Lossless literal candidate; semantic classification is still required.",
      "requirementIds": [
        "CAND-B0633"
      ],
      "sourceBlock": "B0633"
    }
  ],
  "decisions": [],
  "packetId": "RWP-0111",
  "requirements": [
    {
      "id": "CAND-B0632",
      "sourceBlocks": [
        "B0632"
      ],
      "statement": "虽然是后台系统，也要考虑：",
      "title": "14.36 可访问性和移动适配",
      "type": "source-literal"
    },
    {
      "id": "CAND-B0633",
      "sourceBlocks": [
        "B0633"
      ],
      "statement": "- 文本可读。\n- 表单错误清楚。\n- 按钮大小合适。\n- 移动端不拥挤。\n- 关键操作不依赖鼠标悬停。\n- 表格在小屏下有替代展示。",
      "title": "14.36 可访问性和移动适配",
      "type": "source-literal"
    }
  ],
  "schemaVersion": 1,
  "source": {
    "planPath": "../analysis-plan.json",
    "planSha256": "ece89d76cc8979bb8ff3c4b80326d77880a565bde040849307d9bfcfe2ebf059"
  }
}
