{
  "coverage": [
    {
      "classification": "unreviewed",
      "rationale": "Lossless literal candidate; semantic classification is still required.",
      "requirementIds": [
        "CAND-B0543"
      ],
      "sourceBlock": "B0543"
    },
    {
      "classification": "unreviewed",
      "rationale": "Lossless literal candidate; semantic classification is still required.",
      "requirementIds": [
        "CAND-B0544"
      ],
      "sourceBlock": "B0544"
    },
    {
      "classification": "unreviewed",
      "rationale": "Lossless literal candidate; semantic classification is still required.",
      "requirementIds": [
        "CAND-B0545"
      ],
      "sourceBlock": "B0545"
    },
    {
      "classification": "unreviewed",
      "rationale": "Lossless literal candidate; semantic classification is still required.",
      "requirementIds": [
        "CAND-B0546"
      ],
      "sourceBlock": "B0546"
    },
    {
      "classification": "unreviewed",
      "rationale": "Lossless literal candidate; semantic classification is still required.",
      "requirementIds": [
        "CAND-B0547"
      ],
      "sourceBlock": "B0547"
    },
    {
      "classification": "unreviewed",
      "rationale": "Lossless literal candidate; semantic classification is still required.",
      "requirementIds": [
        "CAND-B0548"
      ],
      "sourceBlock": "B0548"
    }
  ],
  "decisions": [],
  "packetId": "RWP-0093",
  "requirements": [
    {
      "id": "CAND-B0543",
      "sourceBlocks": [
        "B0543"
      ],
      "statement": "上线产品需要考虑备份：",
      "title": "14.18 备份和恢复",
      "type": "source-literal"
    },
    {
      "id": "CAND-B0544",
      "sourceBlocks": [
        "B0544"
      ],
      "statement": "- 数据库备份。\n- 文件备份。\n- 配置备份。\n- 打印模板备份。\n- 应用密钥备份策略。",
      "title": "14.18 备份和恢复",
      "type": "source-literal"
    },
    {
      "id": "CAND-B0545",
      "sourceBlocks": [
        "B0545"
      ],
      "statement": "恢复场景：",
      "title": "14.18 备份和恢复",
      "type": "source-literal"
    },
    {
      "id": "CAND-B0546",
      "sourceBlocks": [
        "B0546"
      ],
      "statement": "- 误删业务数据。\n- 配置改错。\n- 文件丢失。\n- 部署升级失败。",
      "title": "14.18 备份和恢复",
      "type": "source-literal"
    },
    {
      "id": "CAND-B0547",
      "sourceBlocks": [
        "B0547"
      ],
      "statement": "注意：",
      "title": "14.18 备份和恢复",
      "type": "source-literal"
    },
    {
      "id": "CAND-B0548",
      "sourceBlocks": [
        "B0548"
      ],
      "statement": "- 密钥不能明文导出。\n- 备份和恢复要记录操作日志。",
      "title": "14.18 备份和恢复",
      "type": "source-literal"
    }
  ],
  "schemaVersion": 1,
  "source": {
    "planPath": "../analysis-plan.json",
    "planSha256": "ece89d76cc8979bb8ff3c4b80326d77880a565bde040849307d9bfcfe2ebf059"
  }
}
