{
  "coverage": [
    {
      "classification": "unreviewed",
      "rationale": "Lossless literal candidate; semantic classification is still required.",
      "requirementIds": [
        "CAND-B0031"
      ],
      "sourceBlock": "B0031"
    },
    {
      "classification": "unreviewed",
      "rationale": "Lossless literal candidate; semantic classification is still required.",
      "requirementIds": [
        "CAND-B0032"
      ],
      "sourceBlock": "B0032"
    },
    {
      "classification": "unreviewed",
      "rationale": "Lossless literal candidate; semantic classification is still required.",
      "requirementIds": [
        "CAND-B0033"
      ],
      "sourceBlock": "B0033"
    }
  ],
  "decisions": [],
  "packetId": "RWP-0005",
  "requirements": [
    {
      "id": "CAND-B0031",
      "sourceBlocks": [
        "B0031"
      ],
      "statement": "产品统一为三个主要工作空间：",
      "title": "4. 产品整体结构",
      "type": "source-literal"
    },
    {
      "id": "CAND-B0032",
      "sourceBlocks": [
        "B0032"
      ],
      "statement": "- 登录后的平台主页面。\n- 平台后台。\n- 系统后台。",
      "title": "4. 产品整体结构",
      "type": "source-literal"
    },
    {
      "id": "CAND-B0033",
      "sourceBlocks": [
        "B0033"
      ],
      "statement": "进入具体系统后还有系统运行态。系统运行态用于使用低代码业务模块，系统后台用于配置系统及其模板能力，两者不能混在一起。",
      "title": "4. 产品整体结构",
      "type": "source-literal"
    }
  ],
  "schemaVersion": 1,
  "source": {
    "planPath": "../analysis-plan.json",
    "planSha256": "ece89d76cc8979bb8ff3c4b80326d77880a565bde040849307d9bfcfe2ebf059"
  }
}
