{
  "coverage": [
    {
      "classification": "unreviewed",
      "rationale": "Lossless literal candidate; semantic classification is still required.",
      "requirementIds": [
        "CAND-B0505"
      ],
      "sourceBlock": "B0505"
    },
    {
      "classification": "unreviewed",
      "rationale": "Lossless literal candidate; semantic classification is still required.",
      "requirementIds": [
        "CAND-B0506"
      ],
      "sourceBlock": "B0506"
    },
    {
      "classification": "unreviewed",
      "rationale": "Lossless literal candidate; semantic classification is still required.",
      "requirementIds": [
        "CAND-B0507"
      ],
      "sourceBlock": "B0507"
    },
    {
      "classification": "unreviewed",
      "rationale": "Lossless literal candidate; semantic classification is still required.",
      "requirementIds": [
        "CAND-B0508"
      ],
      "sourceBlock": "B0508"
    }
  ],
  "decisions": [],
  "packetId": "RWP-0085",
  "requirements": [
    {
      "id": "CAND-B0505",
      "sourceBlocks": [
        "B0505"
      ],
      "statement": "权限中心必须支持：",
      "title": "14.10 权限预览",
      "type": "source-literal"
    },
    {
      "id": "CAND-B0506",
      "sourceBlocks": [
        "B0506"
      ],
      "statement": "- 选择一个用户，预览他能看到哪些菜单。\n- 预览他能操作哪些按钮。\n- 预览他能看到哪些字段。\n- 预览他能查看哪些数据范围。",
      "title": "14.10 权限预览",
      "type": "source-literal"
    },
    {
      "id": "CAND-B0507",
      "sourceBlocks": [
        "B0507"
      ],
      "statement": "使用场景：",
      "title": "14.10 权限预览",
      "type": "source-literal"
    },
    {
      "id": "CAND-B0508",
      "sourceBlocks": [
        "B0508"
      ],
      "statement": "- 管理员配置权限后，马上确认普通用户看到的效果。\n- 排查“为什么某个人看不到菜单”。",
      "title": "14.10 权限预览",
      "type": "source-literal"
    }
  ],
  "schemaVersion": 1,
  "source": {
    "planPath": "../analysis-plan.json",
    "planSha256": "ece89d76cc8979bb8ff3c4b80326d77880a565bde040849307d9bfcfe2ebf059"
  }
}
