{
  "coverage": [
    {
      "classification": "unreviewed",
      "rationale": "Lossless literal candidate; semantic classification is still required.",
      "requirementIds": [
        "CAND-B0059"
      ],
      "sourceBlock": "B0059"
    },
    {
      "classification": "unreviewed",
      "rationale": "Lossless literal candidate; semantic classification is still required.",
      "requirementIds": [
        "CAND-B0060"
      ],
      "sourceBlock": "B0060"
    },
    {
      "classification": "unreviewed",
      "rationale": "Lossless literal candidate; semantic classification is still required.",
      "requirementIds": [
        "CAND-B0061"
      ],
      "sourceBlock": "B0061"
    }
  ],
  "decisions": [],
  "packetId": "RWP-0008",
  "requirements": [
    {
      "id": "CAND-B0059",
      "sourceBlocks": [
        "B0059"
      ],
      "statement": "平台后台面向平台管理员，包含：",
      "title": "4.3 平台后台",
      "type": "source-literal"
    },
    {
      "id": "CAND-B0060",
      "sourceBlocks": [
        "B0060"
      ],
      "statement": "- 平台信息。\n- 组织架构。\n- 角色权限。\n- 数据字典。\n- 系统配置。\n- 其他业务参数配置。\n- Flow配置。\n- 应用配置。\n- AI配置。\n- 审计日志。\n- 运维配置。",
      "title": "4.3 平台后台",
      "type": "source-literal"
    },
    {
      "id": "CAND-B0061",
      "sourceBlocks": [
        "B0061"
      ],
      "statement": "平台后台只管理平台级对象和全局策略。平台管理员不能凭平台身份绕过系统成员、租户和数据权限修改系统业务数据。",
      "title": "4.3 平台后台",
      "type": "source-literal"
    }
  ],
  "schemaVersion": 1,
  "source": {
    "planPath": "../analysis-plan.json",
    "planSha256": "ece89d76cc8979bb8ff3c4b80326d77880a565bde040849307d9bfcfe2ebf059"
  }
}
