{
  "coverage": [
    {
      "classification": "unreviewed",
      "rationale": "Lossless literal candidate; semantic classification is still required.",
      "requirementIds": [
        "CAND-B0572"
      ],
      "sourceBlock": "B0572"
    },
    {
      "classification": "unreviewed",
      "rationale": "Lossless literal candidate; semantic classification is still required.",
      "requirementIds": [
        "CAND-B0573"
      ],
      "sourceBlock": "B0573"
    },
    {
      "classification": "unreviewed",
      "rationale": "Lossless literal candidate; semantic classification is still required.",
      "requirementIds": [
        "CAND-B0574"
      ],
      "sourceBlock": "B0574"
    },
    {
      "classification": "unreviewed",
      "rationale": "Lossless literal candidate; semantic classification is still required.",
      "requirementIds": [
        "CAND-B0575"
      ],
      "sourceBlock": "B0575"
    }
  ],
  "decisions": [],
  "packetId": "RWP-0099",
  "requirements": [
    {
      "id": "CAND-B0572",
      "sourceBlocks": [
        "B0572"
      ],
      "statement": "成熟项目必须处理重复提交：",
      "title": "14.24 幂等和重复提交",
      "type": "source-literal"
    },
    {
      "id": "CAND-B0573",
      "sourceBlocks": [
        "B0573"
      ],
      "statement": "- 表单重复点击保存。\n- 审批按钮重复点击。\n- 应用调用重复请求。\n- 导入任务重复提交。\n- 导出任务重复提交。",
      "title": "14.24 幂等和重复提交",
      "type": "source-literal"
    },
    {
      "id": "CAND-B0574",
      "sourceBlocks": [
        "B0574"
      ],
      "statement": "实现规则：",
      "title": "14.24 幂等和重复提交",
      "type": "source-literal"
    },
    {
      "id": "CAND-B0575",
      "sourceBlocks": [
        "B0575"
      ],
      "statement": "- 使用 requestId 或 idempotencyKey。\n- Redis 保存短时间幂等记录。\n- 审批任务按任务状态防重复处理。\n- 应用调用必须支持幂等键。",
      "title": "14.24 幂等和重复提交",
      "type": "source-literal"
    }
  ],
  "schemaVersion": 1,
  "source": {
    "planPath": "../analysis-plan.json",
    "planSha256": "ece89d76cc8979bb8ff3c4b80326d77880a565bde040849307d9bfcfe2ebf059"
  }
}
