{
  "coverage": [
    {
      "classification": "unreviewed",
      "rationale": "Lossless literal candidate; semantic classification is still required.",
      "requirementIds": [
        "CAND-B0290"
      ],
      "sourceBlock": "B0290"
    },
    {
      "classification": "unreviewed",
      "rationale": "Lossless literal candidate; semantic classification is still required.",
      "requirementIds": [
        "CAND-B0291"
      ],
      "sourceBlock": "B0291"
    },
    {
      "classification": "unreviewed",
      "rationale": "Lossless literal candidate; semantic classification is still required.",
      "requirementIds": [
        "CAND-B0292"
      ],
      "sourceBlock": "B0292"
    },
    {
      "classification": "unreviewed",
      "rationale": "Lossless literal candidate; semantic classification is still required.",
      "requirementIds": [
        "CAND-B0293"
      ],
      "sourceBlock": "B0293"
    },
    {
      "classification": "unreviewed",
      "rationale": "Lossless literal candidate; semantic classification is still required.",
      "requirementIds": [
        "CAND-B0294"
      ],
      "sourceBlock": "B0294"
    },
    {
      "classification": "unreviewed",
      "rationale": "Lossless literal candidate; semantic classification is still required.",
      "requirementIds": [
        "CAND-B0295"
      ],
      "sourceBlock": "B0295"
    }
  ],
  "decisions": [],
  "packetId": "RWP-0041",
  "requirements": [
    {
      "id": "CAND-B0290",
      "sourceBlocks": [
        "B0290"
      ],
      "statement": "平台主页面布局：",
      "title": "6.2 Web 主布局",
      "type": "source-literal"
    },
    {
      "id": "CAND-B0291",
      "sourceBlocks": [
        "B0291"
      ],
      "statement": "- 主导航固定为仪表盘、系统、Flow、应用、任务、AI、待办、消息、个人中心、系统后台、平台后台，并按权限隐藏无权入口。\n- 顶部或页头显示当前平台/系统/租户上下文和用户入口；应用不是上下文切换器。\n- 中间工作区承载一级能力页面，右侧工作区或抽屉承载详情、编辑和配置。",
      "title": "6.2 Web 主布局",
      "type": "source-literal"
    },
    {
      "id": "CAND-B0292",
      "sourceBlocks": [
        "B0292"
      ],
      "statement": "系统运行态布局：",
      "title": "6.2 Web 主布局",
      "type": "source-literal"
    },
    {
      "id": "CAND-B0293",
      "sourceBlocks": [
        "B0293"
      ],
      "statement": "- 进入系统后显示当前系统和租户上下文。\n- 普通系统账号看到有权限的模块组和模块，不显示平台系统卡片列表。\n- 模块组和模块构成业务导航；内容区显示模块列表、表单和详情。",
      "title": "6.2 Web 主布局",
      "type": "source-literal"
    },
    {
      "id": "CAND-B0294",
      "sourceBlocks": [
        "B0294"
      ],
      "statement": "后台布局：",
      "title": "6.2 Web 主布局",
      "type": "source-literal"
    },
    {
      "id": "CAND-B0295",
      "sourceBlocks": [
        "B0295"
      ],
      "statement": "- 平台后台与系统后台使用各自固定菜单，页面上始终显示当前后台层级。\n- 配置页展示草稿、发布版本和状态；不能用“应用配置台”代替平台后台或系统后台。",
      "title": "6.2 Web 主布局",
      "type": "source-literal"
    }
  ],
  "schemaVersion": 1,
  "source": {
    "planPath": "../analysis-plan.json",
    "planSha256": "ece89d76cc8979bb8ff3c4b80326d77880a565bde040849307d9bfcfe2ebf059"
  }
}
