{
  "coverage": [
    {
      "classification": "unreviewed",
      "rationale": "Lossless literal candidate; semantic classification is still required.",
      "requirementIds": [
        "CAND-B0172"
      ],
      "sourceBlock": "B0172"
    },
    {
      "classification": "unreviewed",
      "rationale": "Lossless literal candidate; semantic classification is still required.",
      "requirementIds": [
        "CAND-B0173"
      ],
      "sourceBlock": "B0173"
    },
    {
      "classification": "unreviewed",
      "rationale": "Lossless literal candidate; semantic classification is still required.",
      "requirementIds": [
        "CAND-B0174"
      ],
      "sourceBlock": "B0174"
    },
    {
      "classification": "unreviewed",
      "rationale": "Lossless literal candidate; semantic classification is still required.",
      "requirementIds": [
        "CAND-B0175"
      ],
      "sourceBlock": "B0175"
    }
  ],
  "decisions": [],
  "packetId": "RWP-0027",
  "requirements": [
    {
      "id": "CAND-B0172",
      "sourceBlocks": [
        "B0172"
      ],
      "statement": "必须包含：",
      "title": "5.11 数据记录",
      "type": "source-literal"
    },
    {
      "id": "CAND-B0173",
      "sourceBlocks": [
        "B0173"
      ],
      "statement": "- 新增。\n- 编辑。\n- 删除。\n- 恢复。\n- 详情。\n- 列表。\n- 搜索。\n- 筛选。\n- 排序。\n- 分页。\n- 批量操作。\n- 变更历史。\n- 附件。\n- 关联数据。\n- 子表。\n- 团队成员。\n- 评论回复。\n- 自动编号。\n- 触发流程。",
      "title": "5.11 数据记录",
      "type": "source-literal"
    },
    {
      "id": "CAND-B0174",
      "sourceBlocks": [
        "B0174"
      ],
      "statement": "优化：",
      "title": "5.11 数据记录",
      "type": "source-literal"
    },
    {
      "id": "CAND-B0175",
      "sourceBlocks": [
        "B0175"
      ],
      "statement": "- 保存数据要一起处理主数据、自定义字段值、子表、附件、关联关系、团队成员、变更历史、流程触发。\n- 主数据保存标题、编号、状态、负责人、负责部门、创建人、更新时间等模块通用字段。\n- 自定义字段值按字段类型保存到字段值表。\n- 团队成员支持负责人、协作人、只读成员、关注人。\n- 评论回复保存在系统内，和模块数据详情、消息通知、操作日志联动。\n- 失败时不能半成功。\n- 列表支持保存常用视图。\n- 详情页显示流程状态和历史。\n- 删除优先软删除。",
      "title": "5.11 数据记录",
      "type": "source-literal"
    }
  ],
  "schemaVersion": 1,
  "source": {
    "planPath": "../analysis-plan.json",
    "planSha256": "ece89d76cc8979bb8ff3c4b80326d77880a565bde040849307d9bfcfe2ebf059"
  }
}
