{
  "coverage": [
    {
      "classification": "unreviewed",
      "rationale": "Lossless literal candidate; semantic classification is still required.",
      "requirementIds": [
        "CAND-B0303"
      ],
      "sourceBlock": "B0303"
    },
    {
      "classification": "unreviewed",
      "rationale": "Lossless literal candidate; semantic classification is still required.",
      "requirementIds": [
        "CAND-B0304"
      ],
      "sourceBlock": "B0304"
    },
    {
      "classification": "unreviewed",
      "rationale": "Lossless literal candidate; semantic classification is still required.",
      "requirementIds": [
        "CAND-B0305"
      ],
      "sourceBlock": "B0305"
    },
    {
      "classification": "unreviewed",
      "rationale": "Lossless literal candidate; semantic classification is still required.",
      "requirementIds": [
        "CAND-B0306"
      ],
      "sourceBlock": "B0306"
    },
    {
      "classification": "unreviewed",
      "rationale": "Lossless literal candidate; semantic classification is still required.",
      "requirementIds": [
        "CAND-B0307"
      ],
      "sourceBlock": "B0307"
    },
    {
      "classification": "unreviewed",
      "rationale": "Lossless literal candidate; semantic classification is still required.",
      "requirementIds": [
        "CAND-B0308"
      ],
      "sourceBlock": "B0308"
    }
  ],
  "decisions": [],
  "packetId": "RWP-0043",
  "requirements": [
    {
      "id": "CAND-B0303",
      "sourceBlocks": [
        "B0303"
      ],
      "statement": "高级表格体验：",
      "title": "6.4 列表页",
      "type": "source-literal"
    },
    {
      "id": "CAND-B0304",
      "sourceBlocks": [
        "B0304"
      ],
      "statement": "- 顶部搜索。\n- 高级筛选抽屉。\n- 列设置。\n- 保存视图。\n- 固定列。\n- 批量选择。\n- 行内操作。\n- 右侧详情预览。\n- 快捷导出。",
      "title": "6.4 列表页",
      "type": "source-literal"
    },
    {
      "id": "CAND-B0305",
      "sourceBlocks": [
        "B0305"
      ],
      "statement": "通用行点击规则：",
      "title": "6.4 列表页",
      "type": "source-literal"
    },
    {
      "id": "CAND-B0306",
      "sourceBlocks": [
        "B0306"
      ],
      "statement": "- 所有列表型页面的数据行都必须支持点击整行查看详情。\n- 行点击默认从右侧详情抽屉打开，保留列表上下文；复杂详情可以采用右侧工作区或整页详情。\n- 行内按钮只承载编辑、删除、转移、审批、导出等不同于“查看详情”的动作，不能和行点击重复。\n- 点击复选框、按钮、链接、输入框、下拉框时不得误触发行详情。",
      "title": "6.4 列表页",
      "type": "source-literal"
    },
    {
      "id": "CAND-B0307",
      "sourceBlocks": [
        "B0307"
      ],
      "statement": "高级体验：",
      "title": "6.4 列表页",
      "type": "source-literal"
    },
    {
      "id": "CAND-B0308",
      "sourceBlocks": [
        "B0308"
      ],
      "statement": "- 点击一行右侧打开详情抽屉，复杂详情使用整页。\n- 常用筛选保存为视图。\n- 支持键盘快速切换行。\n- 支持列显示隐藏。",
      "title": "6.4 列表页",
      "type": "source-literal"
    }
  ],
  "schemaVersion": 1,
  "source": {
    "planPath": "../analysis-plan.json",
    "planSha256": "ece89d76cc8979bb8ff3c4b80326d77880a565bde040849307d9bfcfe2ebf059"
  }
}
