{
  "coverage": [
    {
      "classification": "unreviewed",
      "rationale": "Lossless literal candidate; semantic classification is still required.",
      "requirementIds": [
        "CAND-B0428"
      ],
      "sourceBlock": "B0428"
    },
    {
      "classification": "unreviewed",
      "rationale": "Lossless literal candidate; semantic classification is still required.",
      "requirementIds": [
        "CAND-B0429"
      ],
      "sourceBlock": "B0429"
    }
  ],
  "decisions": [],
  "packetId": "RWP-0068",
  "requirements": [
    {
      "id": "CAND-B0428",
      "sourceBlocks": [
        "B0428"
      ],
      "statement": "表格要支持：",
      "title": "9.4 高级表格",
      "type": "source-literal"
    },
    {
      "id": "CAND-B0429",
      "sourceBlocks": [
        "B0429"
      ],
      "statement": "- 虚拟滚动。\n- 固定列。\n- 列拖拽。\n- 列显示隐藏。\n- 服务端分页。\n- 服务端排序。\n- 服务端筛选。\n- 保存视图。",
      "title": "9.4 高级表格",
      "type": "source-literal"
    }
  ],
  "schemaVersion": 1,
  "source": {
    "planPath": "../analysis-plan.json",
    "planSha256": "ece89d76cc8979bb8ff3c4b80326d77880a565bde040849307d9bfcfe2ebf059"
  }
}
